{
  "issuer_id": "x509_aki:TprRzaFBJ1SLjJsO01tlLCQ4YF0",
  "entity_type": "government",
  "entity_metadata": {
    "country": "US",
    "region": "MD",
    "government_level": "state",
    "official_name": "Maryland MVA"
  },
  "display": {
    "name": "Maryland MVA"
  },
  "certificates": [],
  "signature": "MEUCIQDizHdwihLeFF74v90YFabZRpuojeynCUAQ7cq96yVSpAIgQ8fBeLySnK+UupE3HbPUVbKm0Wd+wGcFizj0KijsSdo="
}
