{
  "issuer_id": "x509_aki:jkUgxsSokwmuQNihv5PDD06f6jU",
  "entity_type": "government",
  "entity_metadata": {
    "country": "US",
    "region": "AZ",
    "government_level": "state",
    "official_name": "Arizona Department of Transportation"
  },
  "display": {
    "name": "Arizona Department of Transportation"
  },
  "certificates": [
    {
      "data": "-----BEGIN CERTIFICATE-----\nMIIDDTCCArKgAwIBAgIUbh0WpHxXGCJJnLQ4CNAfO4xOetUwCgYIKoZIzj0EAwIw\ngYAxEzARBgNVBAMMCkdvb2dsZUlBQ0ExLTArBgNVBAoMJEFyaXpvbmEgRGVwYXJ0\nbWVudCBvZiBUcmFuc3BvcnRhdGlvbjELMAkGA1UECwwCSVQxCzAJBgNVBAYTAlVT\nMQ4wDAYDVQQIDAVVUy1BWjEQMA4GA1UEBwwHUGhvZW5peDAeFw0yNTEyMTUxODI1\nMzdaFw0zNTEyMTUxODI1MzdaMIGAMRMwEQYDVQQDDApHb29nbGVJQUNBMS0wKwYD\nVQQKDCRBcml6b25hIERlcGFydG1lbnQgb2YgVHJhbnNwb3J0YXRpb24xCzAJBgNV\nBAsMAklUMQswCQYDVQQGEwJVUzEOMAwGA1UECAwFVVMtQVoxEDAOBgNVBAcMB1Bo\nb2VuaXgwWTATBgcqhkjOPQIBBggqhkjOPQMBBwNCAAQpPSXjZG/enrGvVGkdG5OU\nuw0MKbv83S5YGUG6T8E6nWxSHVBv/WZuT7d9zcQ7+P+A0QsUO9NcF1rkeZwlIiAo\no4IBBjCCAQIwHQYDVR0OBBYEFI5FIMbEqJMJrkDYob+Tww9On+o1MB8GA1UdIwQY\nMBaAFI5FIMbEqJMJrkDYob+Tww9On+o1MBIGA1UdEwEB/wQIMAYBAf8CAQAwDgYD\nVR0PAQH/BAQDAgEGMCwGA1UdEgQlMCOGIWh0dHBzOi8vYXpkb3QuZ292L212ZC9j\nb250YWN0LW12ZDBuBgNVHR8EZzBlMGOgYaBfhl1odHRwczovL212bXB1YmxpYy5i\nbG9iLmNvcmUudXNnb3ZjbG91ZGFwaS5uZXQvY2VydGlmaWNhdGUtcmV2b2NhdGlv\nbi1saXN0LzIvTVZNUHJvZENBLmNybC5wZW0wCgYIKoZIzj0EAwIDSQAwRgIhAKML\ntbOTIDtPupTiIk3+4mqA0UNTWHKQZnuluQQwF7tkAiEAogYKBobaThxeZDOXQCWS\nEEF43za4oQMD3+jmvTD6c3M=\n-----END CERTIFICATE-----",
      "format": "pem",
      "trust_lists": [
        "uv",
        "aamva_dts"
      ]
    }
  ],
  "signature": "MEQCIFCcsI/R/qgGbSds/DpcyVrm0Ekl/kkFHsBW+l2Kk1aKAiAZSnzUzjPvWvTi7xNy9vFqBwe8KyNX2ZwhTZrsfjQkpg=="
}