{
  "issuer_id": "x509_aki:wDtVKIe7jBPw2n78JqJgSuf1wno",
  "entity_type": "government",
  "entity_metadata": {
    "country": "US",
    "region": "NM",
    "government_level": "state",
    "official_name": "New Mexico Taxation and Revenue Department"
  },
  "display": {
    "name": "New Mexico Taxation and Revenue Department"
  },
  "certificates": [
    {
      "data": "-----BEGIN CERTIFICATE-----\nMIIDgjCCAyigAwIBAgIUAIJ4VcLJGUNElxQUSUy6mDxpJrYwCgYIKoZIzj0EAwIw\ngcExDjAMBgNVBAgTBVVTLU5NMQswCQYDVQQGEwJVUzERMA8GA1UEBxMIU2FudGEg\nRmUxMzAxBgNVBAoTKk5ldyBNZXhpY28gVGF4YXRpb24gYW5kIFJldmVudWUgRGVw\nYXJ0bWVudDEqMCgGA1UECxMhTmV3IE1leGljbyBNb3RvciBWZWhpY2xlIERpdmlz\naW9uMS4wLAYDVQQDEyVOZXcgTWV4aWNvIFJvb3QgQ2VydGlmaWNhdGUgQXV0aG9y\naXR5MB4XDTI1MTAwMTA2MDAwMFoXDTMwMTAwMTA2MDAwMFowgcExDjAMBgNVBAgT\nBVVTLU5NMQswCQYDVQQGEwJVUzERMA8GA1UEBxMIU2FudGEgRmUxMzAxBgNVBAoT\nKk5ldyBNZXhpY28gVGF4YXRpb24gYW5kIFJldmVudWUgRGVwYXJ0bWVudDEqMCgG\nA1UECxMhTmV3IE1leGljbyBNb3RvciBWZWhpY2xlIERpdmlzaW9uMS4wLAYDVQQD\nEyVOZXcgTWV4aWNvIFJvb3QgQ2VydGlmaWNhdGUgQXV0aG9yaXR5MFkwEwYHKoZI\nzj0CAQYIKoZIzj0DAQcDQgAEmPrlwEZA1mW8d+ekzFViC/4bxmmWa1IQcbmpGxNw\nCv1h2A2z4BX2N7CSO1sh5Kgeh/JTfT2e7t/VJUC+TE6psqOB+zCB+DAOBgNVHQ8B\nAf8EBAMCAQYwEgYDVR0TAQH/BAgwBgEB/wIBADAdBgNVHQ4EFgQUwDtVKIe7jBPw\n2n78JqJgSuf1wnowKQYDVR0SBCIwIIYeaHR0cHM6Ly93d3cubXZkLm5ld21leGlj\nby5nb3YvMHYGA1UdHwRvMG0wa6BpoGeGZWh0dHBzOi8vc2VydmljZXMubXZkLm5l\nd21leGljby5nb3Yvc2VydmljZXMvZXh0ZXJuYWwvY3JsL2dldExpc3QvZGFlMWE3\nYWQxMmZmNGI0YWIwMDg4MDI0NDg3NmQ5MGYuY3JsMBAGCSsGAQQBg8UhAQQDTlNQ\nMAoGCCqGSM49BAMCA0gAMEUCIQDKU91VZtiRtzly+WaK1ah2fYOTBxuIfIqKzZQk\njInviwIgdV2QIumonPVhepHrdrccIxgbu/pJi/P83PlUAoOW5kY=\n-----END CERTIFICATE-----",
      "format": "pem",
      "trust_lists": [
        "uv"
      ]
    }
  ],
  "signature": "MEUCIHmcYN/YqoI2OFa+QzDuQomw5idqFCPFeNI//jVYxVUwAiEAstd2QhGEX0zNYowguLcoaUhOPxTbPVvoZxV86YNvNaQ="
}
