{
  "issuer_id": "x509_aki:yYcBvfzjEXhrywase5x1u3ploe4",
  "entity_type": "government",
  "entity_metadata": {
    "country": "US",
    "region": "NM",
    "government_level": "state",
    "official_name": "New Mexico Taxation and Revenue Department"
  },
  "display": {
    "name": "New Mexico Taxation and Revenue Department"
  },
  "certificates": [],
  "signature": "MEUCIQClHnqMVGpJ9DsC5wY7bO9VP2nOtOfK1lyKxlLNhmw2LQIgWrquEjFWo66eyjxD09fD52w/PFlEz5q8fhxxpRUTYvY="
}