{
  "issuer_id": "x509_aki:u311Z5J6b8-fcnu4Cvc3L5wMUDY",
  "entity_type": "government",
  "entity_metadata": {
    "country": "US",
    "region": "CA",
    "government_level": "state",
    "official_name": "CA-DMV"
  },
  "display": {
    "name": "CA-DMV"
  },
  "certificates": [
    {
      "data": "-----BEGIN CERTIFICATE-----\nMIICPzCCAeWgAwIBAgIUXd0okOOM5cylFwc2WNK7D2O+ArAwCgYIKoZIzj0EAwIw\nUTELMAkGA1UEBhMCVVMxDjAMBgNVBAgMBVVTLUNBMQ8wDQYDVQQKDAZDQS1ETVYx\nITAfBgNVBAMMGENhbGlmb3JuaWEgRE1WIElBQ0EgUm9vdDAeFw0yMzAzMDExNzE3\nMzlaFw0zMzAxMDcxNzE3MzlaMFExCzAJBgNVBAYTAlVTMQ4wDAYDVQQIDAVVUy1D\nQTEPMA0GA1UECgwGQ0EtRE1WMSEwHwYDVQQDDBhDYWxpZm9ybmlhIERNViBJQUNB\nIFJvb3QwWTATBgcqhkjOPQIBBggqhkjOPQMBBwNCAARgzKB5QsRXYGxmIapA3ilL\noXCDxgTMI2JArA72VQ9gL2DIKkBAclKYtix7vQwUbhbH76mnmbOFSxYlCJtilfl1\no4GaMIGXMB0GA1UdDgQWBBS7fXVnknpvz59ye7gK9zcvnAxQNjASBgNVHRMBAf8E\nCDAGAQH/AgEAMA4GA1UdDwEB/wQEAwIBBjAfBgNVHRIEGDAWgRRpYWNhLXJvb3RA\nZG12LmNhLmdvdjAxBgNVHR8EKjAoMCagJKAihiBodHRwczovL2NybC5kbXYuY2Eu\nZ292L2lhY2Evcm9vdDAKBggqhkjOPQQDAgNIADBFAiAJriK4wEUzgDCK++tIIW+g\nXASUIIcG/XhBNxuk2uHd7QIhAKWC8LFaM8qFsvlujtZZf647zD8BBc6kicj1Imw/\nwujS\n-----END CERTIFICATE-----",
      "format": "pem",
      "trust_lists": [
        "uv"
      ]
    }
  ],
  "signature": "MEYCIQD4hbFevillwQiFxZvR6fOS6qgU68ttmKVWUEg79gbQ9wIhAK4BxHgA/018aGRigoK3Uc/N5r9paZdORvqm4qeRaYfX"
}
