{
  "issuer_id": "x509_aki:6TUKCCDc7eWtyioiOjoDMSChidw",
  "entity_type": "government",
  "entity_metadata": {
    "country": "US",
    "region": "CO",
    "government_level": "state",
    "official_name": "Colorado Department of Revenue"
  },
  "display": {
    "name": "Colorado Department of Revenue"
  },
  "certificates": [],
  "signature": "MEUCIQCanie+Uc/KnilVJVPdzqQPbndjYeUHUQWRzWuhcWKx8QIgIKFDN6BLUDL2AB1b/c1sAA6uOv7awD2ikIMVQgHzYKs="
}
