{
  "issuer_id": "x509_aki:M0IsGLh_yqQ73mhM6h25_AsFp30",
  "entity_type": "government",
  "entity_metadata": {
    "country": "US",
    "region": "AZ",
    "government_level": "state",
    "official_name": "Arizona Department of Transportation"
  },
  "display": {
    "name": "Arizona Department of Transportation"
  },
  "certificates": [],
  "signature": "MEYCIQDjlY7lmF1d9wIlSM9P4BqbJNS/HJJBMCN44x1gOD3I3wIhALATAmjK2IAqwftyIEk5gnFwvpkkWk5AmszyrqFBOOhf"
}