{
  "issuer_id": "x509_aki:LQQN9rn-E3-qEpMlE_YMEV4b3sU",
  "entity_type": "government",
  "entity_metadata": {
    "country": "US",
    "region": "VA",
    "government_level": "state",
    "official_name": "VA mID IACA"
  },
  "display": {
    "name": "VA mID IACA"
  },
  "certificates": [],
  "signature": "MEUCIQDTe26sYIyjnSIvtj4w5HAozDmIs+yf+MlX4ofXupTlWgIgV3sChMpI26J3cSwkoje5/R9sqrtX130JTKKZoADaFmI="
}
